[
  {
    "id": "neighbourhood-karshiyaka",
    "name_bg": "Каршияка",
    "name_en": "Karshiyaka",
    "era_key": "ottoman",
    "year": 1450,
    "period_bg": "XV век (османска епоха)",
    "period_en": "15th century (Ottoman era)",
    "summary_bg": "Възниква северно от река Марица след построяването на нов мост през XV век по време на османската епоха.",
    "summary_en": "Formed north of the Maritsa river after a new bridge was built in the 15th century during the Ottoman era.",
    "source": {
      "title": "Уикипедия — Пловдив",
      "url": "https://bg.wikipedia.org/wiki/%D0%9F%D0%BB%D0%BE%D0%B2%D0%B4%D0%B8%D0%B2",
      "accessed_at": "2026-06-19"
    },
    "lat": 42.158,
    "lng": 24.749,
    "approximate": true
  },
  {
    "id": "neighbourhood-old-town",
    "name_bg": "Старият град",
    "name_en": "The Old Town",
    "era_key": "revival",
    "year": 1850,
    "period_bg": "Античност – Възраждане (XIX в.)",
    "period_en": "Antiquity – Revival (19th c.)",
    "summary_bg": "Ядрото на античния Филипопол върху трите хълма; днешният му облик е оформен от възрожденските къщи на XIX век.",
    "summary_en": "The core of ancient Philippopolis on the three hills; its present character was shaped by the 19th-century Revival houses.",
    "source": {
      "title": "Wikipedia — Old Town (Plovdiv)",
      "url": "https://en.wikipedia.org/wiki/Old_Town_(Plovdiv)",
      "accessed_at": "2026-06-19"
    },
    "lat": 42.148,
    "lng": 24.751,
    "approximate": true
  },
  {
    "id": "neighbourhood-kapana",
    "name_bg": "Капана",
    "name_en": "Kapana",
    "era_key": "revival",
    "year": 1860,
    "period_bg": "Възраждане (XVIII–XIX в.)",
    "period_en": "Revival (18th–19th c.)",
    "summary_bg": "Старият занаятчийски квартал с тесни улички като „капан“, оформен през Възраждането; днес е творчески квартал.",
    "summary_en": "The old craftsmen's quarter of narrow lanes like a \"trap\" (kapan), formed during the Revival; today a creative district.",
    "source": {
      "title": "Lost in Plovdiv — кварталите на Пловдив",
      "url": "https://lostinplovdiv.com/bg/articles/znaete-li-koi-sa-kvartalite-na-plovdiv",
      "accessed_at": "2026-06-19"
    },
    "lat": 42.151,
    "lng": 24.75,
    "approximate": true
  },
  {
    "id": "neighbourhood-kyuchuk-paris",
    "name_bg": "Кючук Париж",
    "name_en": "Kyuchuk Paris",
    "era_key": "modern",
    "year": 1905,
    "period_bg": "Началото на XX век",
    "period_en": "Early 20th century",
    "summary_bg": "Оформя се в началото на XX век, когато бежанци от Македония и Тракия се заселват южно от Централна гара.",
    "summary_en": "Took shape in the early 20th century when refugees from Macedonia and Thrace settled south of the central railway station.",
    "source": {
      "title": "Lost in Plovdiv — кварталите на Пловдив",
      "url": "https://lostinplovdiv.com/bg/articles/znaete-li-koi-sa-kvartalite-na-plovdiv",
      "accessed_at": "2026-06-19"
    },
    "lat": 42.128,
    "lng": 24.738,
    "approximate": true
  },
  {
    "id": "neighbourhood-refugee-quarters",
    "name_bg": "Беломорски и Вардарски",
    "name_en": "Belomorski & Vardarski",
    "era_key": "modern",
    "year": 1925,
    "period_bg": "1920-те (след Първата световна война)",
    "period_en": "1920s (after the First World War)",
    "summary_bg": "Бежански квартали, основани от преселници след Първата световна война.",
    "summary_en": "Refugee quarters founded by settlers after the First World War.",
    "source": {
      "title": "Wikipedia — Plovdiv",
      "url": "https://en.wikipedia.org/wiki/Plovdiv",
      "accessed_at": "2026-06-19"
    },
    "lat": 42.147,
    "lng": 24.773,
    "approximate": true
  },
  {
    "id": "neighbourhood-proslav-komatevo",
    "name_bg": "Прослав и Коматево",
    "name_en": "Proslav & Komatevo",
    "era_key": "socialist",
    "year": 1969,
    "period_bg": "1969 г. (присъединени към града)",
    "period_en": "1969 (incorporated into the city)",
    "summary_bg": "Села, присъединени към административните граници на Пловдив през 1969 година.",
    "summary_en": "Villages incorporated into the administrative boundaries of Plovdiv in 1969.",
    "source": {
      "title": "Wikipedia — Plovdiv",
      "url": "https://en.wikipedia.org/wiki/Plovdiv",
      "accessed_at": "2026-06-19"
    },
    "lat": 42.105,
    "lng": 24.682,
    "approximate": true
  },
  {
    "id": "neighbourhood-trakiya",
    "name_bg": "Жилищен комплекс „Тракия“",
    "name_en": "Trakiya housing complex",
    "era_key": "socialist",
    "year": 1973,
    "period_bg": "Строеж от 1973 г.",
    "period_en": "Built from 1973",
    "summary_bg": "Голям панелен жилищен комплекс по проект на арх. Иван Попов (1968 г.); строежът започва през 1973 г., а самостоятелен район става през 1983 г.",
    "summary_en": "A large prefab housing complex designed by architect Ivan Popov (1968); construction began in 1973 and it became a separate district in 1983.",
    "source": {
      "title": "Уикипедия — Тракия (район на Пловдив)",
      "url": "https://bg.wikipedia.org/wiki/%D0%A2%D1%80%D0%B0%D0%BA%D0%B8%D1%8F_(%D1%80%D0%B0%D0%B9%D0%BE%D0%BD_%D0%BD%D0%B0_%D0%9F%D0%BB%D0%BE%D0%B2%D0%B4%D0%B8%D0%B2)",
      "accessed_at": "2026-06-19"
    },
    "lat": 42.151,
    "lng": 24.803,
    "approximate": true
  }
]
